ID,Status,Zonal office,Company,Incident number,Incident date,Report date,Contaminant,Estimated quantity,Quantity recovered,Spill stop date,Type of facility,Cause,Initial containment measures,Site location name,Latitude,Longitude,LGA,Estimated spill area,Spill area habitat,Description of impact,States affected,,Form A date,Form B date,Form C date,JIV date,Present at JIV,Cleanup date,Cleanup completed date,Cleanup methods,Post-cleanup inspection date,Post-impact assessment date,Remediation start,Remediation end,Remediation type,Final sampling date,Final lab results date,Certificate date,Certificate number,Last updated by
465916,confirmed,ak,ESSO,004/2026,2026-02-17,2026-02-17,cr,0.005434,,2026-02-17,fp,ome,other: Outlet line unblocked; Sheen observed to self - dissipate and sea state cleaned,Erha FPSO OML 133/ offshore,4.3358333,5.3516667,Erha FPSO OML 133/ offshore,,of,"Observed silvery sheen on the portside of the FPSO, traced to a blocked open drain tank liquid outlet",ON,,2026-02-19,,,,,,,,,,,,,,,,,2026-03-02 AB008
465929,confirmed,wa,RENAISSANCE,2026 - 000412,2026-02-15,2026-02-15,cr,0.063,,,fl,sab,bm,4'' OTUMARA WELL 22L FLOWLINE @ UGBOEGUNGUN,5.6542033,5.1585853,Warri-South-West,,sw,"Vegetation, surface water and soil were impacted, the spill was within the company's right of way",DE,,,,,2026-02-20,"nosdra,dpr,mnstry,cmpny,cmmnt",2026-02-20,2026-02-20,Natural attenuation.,2026-03-03,,,,,,,,,"2026-02-25 WA006, 2026-03-16 WA006"
465911,confirmed,wa,Heritage,HEOSL/2026/326,2026-02-15,2026-02-16,cr,1,,,fl,sab,other:none,ERIEMU WELL 16S,5.5251830,6.0548333,Ughelli-North,,la,"Soil and vegetation was impacted, the spill was within the company's right of way.",DE,,,,,2026-02-18,"nosdra,dpr,mnstry,cmpny,cmmnt",,,,,,,,,,,,,2026-02-19 WA006
465788,confirmed,wa,CHEVRON,NOSDRA/003/2026,2026-02-14,2026-01-14,cr,0.4,,,pl,cor,bm,"16"" MAKARABA - UTONANA - ABITEYE PIPELINE ROW AT UTONANA",5.7275778,5.3466611,Warri-South-West,,sw,Surface water was impacted and the incident was within the company's right of way.,DE,,,,,2026-01-31,"nosdra,cmpny,dpr,mnstry",,,,,,,,,,,,,2026-02-03 WA006
465943,confirmed,wa,Heritage,heosl/2026/325,2026-02-07,2026-02-07,cr,60,20,,pl,eqf,bm,28'' TRANS FORCADOS PIPELINE AT EWEREGBENE,5.5444167,5.5161111,Warri-South-West,,sw,"Vegetation and surface water were impacted, the spill was within and outside the company's right of way.",DE,,2026-02-16,,,2026-02-14,"nosdra,dpr,cmpny,cmmnt,mnstry",,,,,,,,,,,,,2026-02-26 WA006
465842,confirmed,ak,ESSO,002/2026,2026-02-04,2026-02-06,cr,0.000755,,2026-02-04,fp,ome,other: Hazardous open drain tank outlet line unblocked; sheen observed to self-dissipate and sea state cleared,Erha FPSO OML 133,5.3516667,4.3358333,Ilaje LGA,,of,Oil Sheen on Surface Water: False readings on tank level instrumentation which was traced to a blocked hazardous open drain tank liquid outlet,ON,,2026-02-06,,,,,,,,,,,,,,,,,2026-03-02 AB008
465829,confirmed,wa,NEPL,NEPL/HSE/MOS/98/001/26,2026-02-03,2026-02-03,cr,10,,,pl,sab,other:none,10'' OVADE - OGHARA AMUKPE EXPORT LINE @ MOSOGAR,5.9096833,5.7041111,Ethiope-West,,sw,"Surface water, vegetation and soil were impacted. Broken clamp cover, loosed knots and bent knots went observed at the company's pipeline.",DE,,,,,2026-02-04,"nosdra,dpr,mnstry,cmpny,cmmnt",,,,,,,,,,,,,2026-02-05 WA006
465900,confirmed,by,RENAISSANCE,2026_000388,2026-02-02,2026-02-02,no,,,,fl,sab,,ETELEBOU WELL 12T FLOWLINE AT OGBOLOMA,5.0308889,6.3667306,Yenagoa,,ss,THE CAUSE OF SPILL WAS DUE TO SABOTAGE SINCE THERE WAS AN EVIDENCE OF 2'' VALVE INSTALLATION ON THE FACILITY.,BY,,2026-02-04,,,2026-02-04,"nosdra,dpr,cmpny,cmmnt",,,,,,,,,,,,,2026-03-18 BY015
465901,confirmed,by,RENAISSANCE,2026_000378,2026-01-27,2026-01-27,cr,35,,2026-01-28,fl,sab,,4'' ADNE WELL 4L FLOELINE AT TEIN BISENI,5.2520972,6.5338889,Yenagoa,0.0019,ss,THE CAUSE OF SPILL WAS AS A RESULT OF SABOTAGE SINCE THERE WAS VISIBLE HACKSAW CUT ON THE FLOWLINE. THE AREA OF IMPACT WAS OUSIDE COMPANY RIGHT OF WAY,BY,,2026-01-23,,,2026-01-28,"nosdra,mnstry,cmpny,cmmnt",,,,,,,,,,,,,2026-03-18 BY015
465861,confirmed,wa,SEPLAT,SEPLAT/WA/GS/01/2026,2026-01-27,2026-01-27,no,,,,other:Bulkline,eqf,,6'' OROGHO - OKPORHURHU NAG BULKLINE.,5.8483472,5.9110556,Ethiope-West,,la,Rupture of the bulkline,DE,,,,,2026-01-29,"nosdra,dpr,mnstry,cmpny,cmmnt",,,,,,,,,,,,,2026-02-12 WA006
465860,confirmed,wa,SEPLAT,SEPLAT/WA/OS/04/2026,2026-01-26,2026-01-26,no,,,,other:Trunkline,sab,,24'' AMUKPE - RAPELE TRUNKLINR ROW,5.7977694,5.6975889,Sapele,,la,An illegal 3'' hot tap valve with 3'' connector pipe attached to the company trunkline at 12 O' clock position.,DE,,,,,2026-01-28,"nosdra,dpr,mnstry,cmpny,cmmnt",,,,,,,,,,,,,2026-02-12 WA006
465794,confirmed,wa,RENAISSANCE,000370,2026-01-22,2026-01-22,cr,0.2,,,fl,cor,nd,6'' YOKRI MANIFOLD 6 HP BULKLINE @ SOKEBOLOU,5.4335000,5.2664000,Burutu,,ss,Soil and vegetation were impacted and the incident was within the company's right of way.,DE,,,,,2026-01-27,"nosdra,cmpny,cmmnt,dpr,mnstry",,,,,,,,,,,,,"2026-02-03 WA006, 2026-02-25 WA006"
465804,confirmed,wa,CHEVRON,NOSDRA/002/2026,2026-01-21,2026-01-21,no,,,,pl,sab,,8'' PIPELINE FROM DIBI RMP 23 & 24 TO DIBI PLATFORM,5.7797100,5.2683400,Warri-North,,sw,An illegal 3'' valve was installed on the company's 8'' pipeline at 12 O clock position.,DE,,,,,2026-01-27,"nosdra,dpr,mnstry,cmpny,cmmnt",,,,,,,,,,,,,2026-02-03 WA006
465730,confirmed,lg,NIGERIAN INDEPENDENT PETROLEUM COMPANY (NIPCO),,2026-01-19,2026-01-19,re,157.2327,94.3396,2026-01-19,tk,other: Accident,other: None,"Liverpool Bridge, Apapa, Lagos",6.4397681,3.3590028,Apapa,0.00250000,la,Medium,LA,,2026-01-19,,,2026-01-19,"cmpny,nosdra,plc,cmmnt,mnstry,oth",2026-01-19,2026-01-19,"Manual scooping, Foam compound,",2026-01-19,,,,,,,,,2026-01-27 LA003
465615,confirmed,wa,SEPLAT,SEPLAT/WA/OS/02/2026,2026-01-19,2026-01-19,cr,5,4,2026-01-22,other:delivery line,sab,bm,10'' SAPELE - AMUKPE DELIVERY LINE @ URHUAKPA IN SAPELE-OKPE COMMUNITY.,5.8608861,5.6775778,Sapele,,ss,"Vegetaion, surface water and soil were impacted, the spill was within and outside the company's right of way. An illegal 3'' hot tap valve attached to a 2'' connector pipe (hose) was installed on the company's delivery line at 12 O' clock position",DE,,2026-01-26,2026-02-10,2026-02-10,2026-01-22,"nosdra,dpr,mnstry,cmpny,cmmnt",,,,,,,,,,,,,"2026-01-24 WA006, 2026-01-30 WA006, 2026-02-12 WA006"
452128,confirmed,ak,ESSO,001/2026,2026-01-17,2026-01-19,cr,0.002642,,2026-01-17,fp,eqf,other: Sheen observed to self-dissipate and sea state cleared,Erha FPSO OML 133,5.3511111,4.3347222,ILAJE,,of,Oil Sheen Observed to Self-Dissipate,ON,,2026-01-19,,,,,,,Self Dissipation,,,,,,,,,,2026-03-02 AB008
465830,confirmed,wa,Heritage,HEOSL/2026/322,2026-01-16,2026-01-17,cr,25,10,,pl,cor,bm,28'' TRANS FORCADOS PIPELINE @ ODIDI / KANTU,5.5256028,5.4879444,Warri-South-West,,sw,"Vegetation, surface water and soil were impacted, the spill was within and outside the company's right of way.",DE,,2026-02-03,2026-02-09,,2026-02-04,"nosdra,mnstry,cmpny,cmmnt",,,,,,,,,,,,,"2026-02-05 WA006, 2026-02-09 WA006"
465718,confirmed,wa,SEPLAT,SEPLAT/WA/OS/01/2026,2026-01-14,2026-01-14,cr,0.06,,,other:Trunk line,sab,other:none,24'' AMUKPE - RAPELE TRUNKLINE AT AMUKPE COMMUNITY.,5.8377611,5.6968639,Sapele,,la,An illegal 3'' hot tap valve was installed on the company's trunk line at 12 O' clock position . Soil was impacted.,DE,,2026-01-20,2026-02-10,2026-02-10,2026-01-20,"nosdra,dpr,mnstry,cmpny,cmmnt",,,,,,,,,,,,,"2026-01-26 WA006, 2026-01-30 WA006, 2026-02-12 WA006"
465740,confirmed,wa,ERL,ERL/M128/HSSE/NO/2026/001,2026-01-12,2026-01-12,cr,1,,,pl,eqf,bm,6'' EXPORT PIPELINE TP3 AT KOLOKOLO,6.0711300,5.4571606,Ikpoba-Okha,,sw,"Vegetation and soil were impacted, the spill was within the company's right of way.",DE,,,,,2026-01-13,"nosdra,dpr,cmpny,cmmnt",,,,,,,,,,,,,2026-01-28 WA006
465739,confirmed,wa,RENAISSANCE,000347,2026-01-10,2026-01-10,cr,55,25,,pl,ome,"bm,bw",20'' TRANS ESCRAVOS PIPELINE AT UGBOEGUNGUN,5.6185158,5.1703739,Warri-South-West,,sw,"Vegetation, surface water, soil and shoreline were impacted, the spill was within and outside the company's right of way.",DE,,,,,2026-01-19,"nosdra,dpr,mnstry,cmpny,cmmnt",,,,,,,,,,,,,"2026-01-28 WA006, 2026-02-25 WA006"
465742,confirmed,wa,Midwestern,MWOG/UPIL/001/2026,2026-01-07,2026-01-07,cr,0.3,,,pl,eqf,other: None,"12"" MWOG KWALE ERIEMU PIPELINE AT UMUSAM",5.7013889,6.3955556,Ndokwa-West,,la,Vegetation and soil were impacted and the incident was within the company's right of way.,DE,,,,,2026-01-08,"nosdra,cmpny,cmmnt,dpr,mnstry",,,,,,,,,,,,,2026-02-03 WA006
465838,confirmed,by,NAOC,2026/SAR/001,2026-01-04,2026-01-04,cr,0.31,nil,2026-01-05,wh,sab,bm,"Osiama Wellhead at Okpotware, Korokorosei and Andeware in Southern Ijaw LGA Bayelsa State.",4.7523611,6.0297222,Southern-Ijaw,0.00012575,sw,Unknown persons opened one of the Annulus B valve on the abondoned Well for theft activities.,BY,,2026-01-07,2026-02-04,2026-02-14,2026-01-05,"nosdra,mnstry,cmpny,mltry",,,,,,,,,,,,,2026-03-18 BY015
465942,confirmed,wa,Heritage,HEOSL/2026/321,2026-01-02,2026-01-02,cr,10,,,pl,eqf,other:none,28'' TRANS FORCADOS PIPELINE AT KANTU-ODIDI,5.5608333,5.7588889,Uvwie,,la,"Vegetation, surface water and soil were impacted, the spill was within and outside the company's right of way.",DE,,2026-01-05,2026-01-27,,2026-01-07,"nosdra,dpr,mnstry,cmpny,cmmnt",,,,,,,,,,,,,2026-02-26 WA006
452096,confirmed,lg,DANGOTE PETROLEUM REFINERY & PETROCHEMICALS FZE,01/2026,2026-01-01,2026-01-02,cr,1,Nil,2026-01-01,pl,ome,Dispersant,Lekki Offshore,6.3508333,3.8666667,Eti Osa 2,0.00010000,of,Slight,LA,,2026-01-02,,,2026-01-08,"cmpny,nosdra",2026-01-01,2026-01-08,Dispersant,,,,,,,,,,2026-01-09 LA003
465720,confirmed,by,NAOC,2025/SAR/085,2025-12-29,2025-12-29,cr,2,,2025-12-31,fs,ome,bm,"API Obama skimmer@Obamaflowstation in Nembe, Bayelsa state.",4.6302500,6.2655278,Nembe,352.442,sw,The Operator failed to close the control valve that lead to excessive discharge from the API skimmer leading to leakage of crude oil within the facility.,BY,,2025-12-24,,,2025-12-31,"nosdra,mnstry,mltry",,,,,,,,,,,,,"2026-03-02 AB008, 2026-03-16 BY015"
465837,confirmed,by,NAOC,2026/SAR/151,2025-12-27,2025-12-27,cr,2,,2026-01-04,fl,sab,bm,"6'' Ogboinbiri Deep 5 Flowline at Ogboinbiri, Southern Ijaw LGA Bayelsa State.",4.8214722,5.9780556,Southern-Ijaw,0.00078600,sw,Hacksaw cut of about 120mm long was observed as at the time of JIV on a 6'' Flowline at 7 0'clock position.,BY,,,,,2026-01-04,"nosdra,mnstry,cmpny,cmmnt,mltry",,,,,,,,,,,,,2026-03-02 AB008
465933,confirmed,wa,RENAISSANCE,2025-000302,2025-12-21,2025-12-21,cr,1205.68,905.68,,st,eqf,bw,FOT DEHYDRATION TANK LIQUID AT FORCADOS TERMINAL.,5.5037500,5.3493333,Warri-South-West,,la,"Soil was impacted, the spill was within the company's right of way.",DE,,,,,2025-12-30,"nosdra,dpr,mnstry,cmpny,cmmnt",,,,,,,,,,,,,2026-02-26 WA006
452088,confirmed,ph,OANDO,2025/LAR/067,2025-12-21,2025-12-21,cr,0.91,,,fl,sab,bm,"4""Odugri 1ss Flowline behind Akri Perimeter Fence, Ohaji/Egbema LGA, Imo State",5.6322222,6.6705833,Ogba/Egbema/Ndoni,111,la,A section of the pipe was harvested and carted away with by unknown persons,RI,,,,,2025-12-24,"nosdra,mnstry,cmpny,cmmnt",,,,,,,,,,,,,2026-01-26 AB008
452087,confirmed,ph,OANDO,2025/LAR/065,2025-12-21,2025-12-21,co,7.5,,,pl,sab,other: containment pit,"8"" Obiafu 43/44T Pipeline @ Omoku community, ONELGA",5.3955556,6.6372778,Ogba/Egbema/Ndoni,1176,la,"2"" Threaded ball valve attached @ 11 O' clock position and 115mm hacksaw cut observed at 4 - 6 O' clock position",RI,,,,,2025-12-24,"nosdra,mnstry,cmpny,cmmnt",,,,,,,,,,,,,2026-01-26 AB008
452085,confirmed,ph,OANDO,2025/LAR/066,2025-12-21,2025-12-27,cr,,,2025-12-28,fl,cor,,"4"" ODUGRI 5L FLOWLINE @ AKRI",5.6322500,6.6706944,Ogba/Egbema/Ndoni,0.00001450,la,Incident occurred within the Akri Flow Station. the pipe was slightly corroded with a 10mm hole from a dent near a previously patch plated spot on the pipe.,IM,,,,,2025-12-28,"nosdra,mnstry,cmpny,cmmnt",,,,,,,,,,,,,2026-01-26 AB008
452082,confirmed,uy,MPN,025 / 2025,2025-12-17,2025-12-18,co,0.004113,,,other:,eqf,,Ubit PP / Unam CB WH /OML 67,4.3007206,8.2026572,,,of,"During routine visit to UnamCB, operatorsobserved bubbles in the sea in the vicinity of the Unamgas lift line. Investigation is ongoing as to the source of the bubbles",AK,,2025-12-18,,,,,,,,,,,,,,,,,2026-01-26 AB008
466013,confirmed,wa,POOCN,POOC/125002,2025-12-15,2025-12-15,ga,,,,pl,sab,other:none,10'' GAS EXPORT PIPELINE AT OBAZAGBON,6.0276167,6.0471667,Ohionmwon,,sw,An illegal 3'' valve with clamp was attached to the company's pipeline,ED,,,,,2025-12-16,"nosdra,dpr,cmpny,cmmnt",,,,,,,,,,,,,2026-03-10 WA006
465941,confirmed,wa,Heritage,HEOSL/2026/320,2025-12-08,2025-12-09,cr,40,,,pl,cor,bm,28'' TRANS FORCADOS PIPELINE AT KANTU-ODIDI,5.5222483,5.4845217,Warri-South-West,,sw,"Vegetation, surface water and soil were impacted, the spill was within and outside the company's right of way.",DE,,,2026-01-27,,2026-01-07,"nosdra,dpr,mnstry,cmpny,cmmnt",,,,,,,,,,,,,2026-02-26 WA006
452060,confirmed,wa,Platform,"PPL/HSE/ROW/03/8""/2025",2025-12-08,2025-12-08,cr,5,0.9,,pl,sab,nd,"PLATFORM PETROLEUM LIMITED (PPL) 8"" EXPORT LINE TO OANDO AT UMUSADEGE",5.6899167,6.4669267,Ndokwa-East,,la,"Illegal removal of 8"" ball valve from the pipeline that impacted the vegetation and soil within the Company's right of-way",DE,,,,,2025-12-10,"nosdra,cmpny,cmmnt,dpr,mnstry",,,,,,,,,,,,,2025-12-18 WA003
449035,confirmed,ph,OANDO,2025/LAR/064,2025-12-05,2025-12-05,co,6.04,,2025-12-05,pl,sab,bm,10'' OBIAFU 41/42T PIPELINE @ OBIAFU FIELD OMOKU,5.3973611,6.6274444,Ogba/Egbema/Ndoni,0.00019400,la,UNKNOWN PERSON(S) INSTALLED 2'' MPT BALL VALVE ON THE FACILITY AT 6O'CLOCK POSITION FOR OIL THEFT ACTIVITY,RI,,,,,2025-12-05,"nosdra,cmmnt,cmpny,mnstry,plc",,,,,,,,,,,,,2026-03-02 AB008
452081,confirmed,uy,MPN,024 / 2025,2025-12-02,2025-12-03,cr,0.53,,,other:,other:,"other: The pinhole was isolated, wells secured and the wellhead platform was shut down. Mechanical agitationwascarried out to disperse the sheen. Plans underway to clampthe pin hole.",Asasa VB Wellhead Platform / OML 67,4.0636111,8.0380556,,,of,,AK,,2025-12-03,,,,,,,,,,,,,,,,,2026-01-26 AB008
449031,confirmed,wa,OANDO,2025/LAR/063/143,2025-12-01,2025-12-01,cr,5,,,fl,sab,other:none,2'' CRUDE RETURN LINE FROM FLARE AREA BEHIND KWALE GAS PLANT @ BENEKU COMMUNITY.,5.6578500,6.5174367,Ndokwa-East,,la,"Vegetation and soil were impacted, the spill was within the companys' right of way. Some section of the company's 2'' crude return line was harvested by unknown vandals.",DE,,,,,2025-12-03,"nosdra,dpr,mnstry,cmpny,cmmnt",,,,,,,,,,,,,2025-12-04 WA006
452076,confirmed,ph,Heirs Energies Limited,IN - 0483,2025-11-30,2025-11-30,cr,,,,pl,sab,,8'' NKALI - IMOR DELIVERY LINE,4.9872167,7.1571833,Etche,,la,Observation confirmed the installation of a ball valve with a locally fabricated clamp at the 11 o’clock position on the delivery line,,,,,,2025-12-01,"nosdra,mnstry,cmmnt,cmpny,mltry",,,,,,,,,,,,,2026-01-26 AB008
452074,confirmed,ph,Heirs Energies Limited,IN-0661,2025-11-30,2025-11-30,cr,0.05,0.03,2025-12-01,pl,sab,bw,8'' NKALI - IMOR DELIVERY LINE,4.9843972,7.1289361,Etche,0.00000600,la,Inspection revealed a slackened bolts on a previously installed clamp,,,,,,2025-12-01,"nosdra,mnstry,cmmnt,cmpny,mltry",,,,,,,,,,,,,2026-01-26 AB008
452059,confirmed,ph,Heritage,IN-0790,2025-11-30,2025-12-01,cr,70,63,2025-12-01,pl,sab,tr,"6"" OBIGBO-OGALE DELIVERY LINE AT KOM-KOM, RIVER-STATE '",4.8350556,7.1560000,Eleme,0.00004060,la,"2 NO(S) 6"" ball valves installed at 12 0'clock position on the Delivery Line using a 0.9m pipe. Crude oil was contained in a trench and vegetation surrounding the incident point, was impacted along the ROW",RI,,,,,2025-12-01,"cmmnt,nosdra,mnstry,cmpny",,,,,,,,,,,,,2026-01-26 AB008
465766,confirmed,ph,OANDO,2025'LAR/NLI/052,2025-11-29,2025-11-29,no,,,,pl,sab,,"8"" OB/OB - ELEME (INDORAMA) NGL DELIVERY LINE OMERELU COMMUNITY, IKWERRE KP 23B",5.2528889,6.8186111,Emuoha,,,"Installed 2"" Ball valve on facility at 10 O'clock position for theft activity",RI,,,,,2025-11-29,"nosdra,cmpny,mnstry,cmmnt",,,,,,,,,,,,,2026-03-02 AB008
465763,confirmed,ph,OANDO,2025/LAR/NLI/048,2025-11-29,2025-11-29,no,,,,pl,sab,,"*"" OB/OB - ELEME (INDORAMA) NGL DELIVERY LINE CHOKOCHO COMMUNITY KP 63",4.9947500,7.0378056,Etche,,,,RI,,,,,2025-11-29,"nosdra,cmpny,cmmnt,mnstry",,,,,,,,,,,,,2026-03-02 AB008
465762,confirmed,ph,OANDO,2025/LAR/NLI/047,2025-11-29,2025-11-29,no,,,,pl,sab,,"8"" OB/OB -ELEME (INDORAMA) NGL DELIVERY LINE IGBO -ETCHE COMMUNITY KP 65",4.9632861,7.0503306,Etche,,,,RI,,,,,2025-11-29,"nosdra,mnstry,cmpny,cmmnt",,,,,,,,,,,,,2026-03-02 AB008
465761,confirmed,ph,OANDO,2025/LAR/NLI/050,2025-11-29,2025-11-29,no,,,,pl,sab,,"8"" ob/ob - Eleme (Indorama) NGL Delivery Line Umuchem Community KP 62,",5.0091667,7.0362250,Etche,,,"2 number of one and a half inches position, spaced approximately 4m apart",,,,,,2025-11-29,"nosdra,mnstry,cmpny,cmmnt",,,,,,,,,,,,,2026-03-02 AB008
465774,confirmed,ph,OANDO,2025/LAR/NLI/044,2025-11-28,2025-11-28,no,,,,pl,sab,,"8"" OB/OB - ELEME (INDORAMA) NGL DELIVERY LINE ABARA COMMUNITY, ETCHE LGA",5.0373889,7.0084167,Etche,,,,RI,,,,,2025-11-28,"nosdra,mnstry,cmpny,cmmnt",,,,,,,,,,,,,2026-03-02 AB008
465771,confirmed,ph,OANDO,2025/LAR/NLI/043,2025-11-28,2025-11-28,no,,,,pl,sab,,"8"" OB/OB - ELEME (INDORAMA) NGL DELIVERY LINE ETCHE LGA, ABARA COMMUNITY,",5.0451667,7.0015556,Etche,,,,RI,,,,,2025-11-28,"nosdra,mnstry,cmpny,cmmnt",,,,,,,,,,,,,2026-03-02 AB008
465770,confirmed,ph,OANDO,2025/LAR/NLI/046,2025-11-28,2025-11-28,no,,,,gl,sab,,"8"" OB/OB - ELEME (INDORAMA) NGL DELIVERY LINE UMUECHEM COMMUNITY, ETCHE KP 59",5.0251944,7.0192222,Etche,,,"3 NUMBERS OF BALL VALVES INSTALLED , ONE IS A 2"" BALL VALVES INSTALLED AT 11 O'CLOCK POSITION,, 4"" BALL VALVE INSTALLED AT 1 O' CLOCK POSITION AND 2"" BALL VALVE INSTALLED AT 12 o' CLOCK POSITION",RI,,,,,2025-11-28,"nosdra,mnstry,cmpny,cmmnt",,,,,,,,,,,,,2026-03-02 AB008
449034,confirmed,ph,RENAISSANCE,000262,2025-11-28,2025-11-28,no,,,2025-11-28,pl,sab,,"2""Ebubu-Bonny pipeline at Ogbonga Forest/Oloma Bonny LGA Rivers State",4.4363889,7.1830556,Bonny,,sw,"4"" ball valve installed at 12 o'clock position by unknown person",RI,,,,,2025-12-03,"nosdra,mnstry,cmpny,cmmnt,mltry",,,,,,,,,,,,,2026-03-02 AB008
449033,confirmed,ph,RENAISSANCE,000262,2025-11-28,2025-11-28,cr,,,2025-11-28,pl,sab,,"28""Ebubu-Boony Pipeline@Ogbonga forest/Oloma Bonny L.G.A",4.4363889,7.1830556,Bonny,,sw,"4""ball valve installed on 28"" Ebubu Bonny pipeline at12, o'clock position by unknown person",RI,,,,,2025-12-3,"cmmnt,cmpny,mltry,mnstry,nosdra",,,,,,,,,,,,,2026-03-02 AB008
449038,confirmed,by,OANDO,2025/SAL/GL/024,2025-11-27,2025-11-27,co,1.1950,,2025-11-27,fl,sab,,"6” Ogboinbiri Deep 5 Gas Flowline at Ogboinbiri, Silga, Bayelsa State.",4.8203333,5.9798333,Southern-Ijaw,0.0733,sw,Vandal(s) used Hack saw to effect about 120mm long from 1 to 4 O clock position on the facility for Condensate theft activities.,BY,,,,,2025-11-27,"nosdra,mnstry,cmpny,mltry",,,,,,,,,,,,,2026-01-21 AB017
449016,confirmed,ph,RENAISSANCE,2025-000258,2025-11-27,2025-11-27,cr,,,,pl,sab,,"12""OGALE-EBUBU P/L @ OGALE IN ELEME LGA",4.806715,7.152555,Eleme,,la,"LOCALLY FABRICATED CLAMP CONNECTED TO 1.5""GALVANIZED PIPELINE OUT FURTHER CONNECTED TO 1""HOSE INSTALED AT 12 O'CLOCK POSITION BY AN UNKNOWN PERSON",RI,,,,,2025-11-30,"nosdra,mnstry,cmpny,cmmnt,plc",,,,,,,,,,,,,2026-01-26 AB008
449018,confirmed,ph,OANDO,2025/LAR/062,2025-11-25,2025-11-25,cr,4.51,,2025-11-25,fl,sab,bm,"4"" OSHIE 15s FLOWLINE, OSHIE COMMUNITY, AWELGA, RIVERS STATE",5.1015556,6.4917222,Ahoada-West,543.98,la,"UNKNOWN PERSONS INSTALLED 1 1/2 -INCH NIPPLE ON THE FACILITY AT 6 O'CLOCK POSITION, PRESUMABLY FOR CRUDE OIL THEFT ACTIVITY",RI,,,,,2025-11-26,"nosdra,cmpny,mnstry,cmmnt,plc,mltry",,,,,,,,,,,,,2026-03-02 AB008
449015,confirmed,ph,RENAISSANCE,20225-000256,2025-11-24,2025-11-24,,,,,pl,ome,,"24'' Ogale - Bonny P/Line @ Free Town , Bonny.",4.51129213,7.22974316,Bonny,,of,Non-leak.,RI,,,,,2025-11-27,"nosdra,cmmnt,cmpny,mnstry",,,,,,,,,,,,,2026-01-26 AB008
449014,confirmed,ph,RENAISSANCE,2025-000252,2025-11-24,2025-11-25,,,,,pl,cor,,"24'' Ogale - Bonny P/line @ Okolo Launch , Bonny",4.50917021,7.22783717,Bonny,,of,Water Leak.,RI,,,,,2025-11-27,"nosdra,cmmnt,cmpny,mnstry",,,,,,,,,,,,,2026-01-26 AB008
449013,confirmed,ph,RENAISSANCE,2025-000253,2025-11-24,2025-11-24,Water,,,,pl,sab,N/A,"24'' Ogale-Bonny P/line @ Okolo Launch, Bonny.",4.50846003,7.22718840,Bonny,,of,Water leak.,RI,,,,,2025-11-27,"nosdra,cmmnt,cmpny,mnstry",,,,,,,,,,,,,2026-01-26 AB008
449012,confirmed,ph,RENAISSANCE,000253,2025-11-24,2025-11-24,,,,,pl,cor,,24'' Ogale--Bonny p/line @ Okolo Launch.,4.50846003,7.22718840,Bonny,,of,Water leak,RI,,,,,2025-11-27,"nosdra,cmmnt,cmpny,mnstry",,,,,,,,,,,,,2026-03-02 AB008
452080,confirmed,uy,MPN,023 / 2025,2025-11-19,2025-11-20,other:,0.000440,,,other: Open Drain,ome,"other: Operations personnel sent to site and the blockeddrainwasunblocked. The sheen naturally dispersed completely on the samedayNovember 19, 2025.",Usari PP / Abang Satellite Platform /OML 70,4.2394444,7.6519444,,,of,Field Security Vessel (MV Mediator III) reported sheen. The sheen was traced to rainwater wash off of residual hydraulic oil from blocked open drain receptacle at crane deck.,AK,,2025-11-20,,,,,,,,,,,,,,,,,2026-01-26 AB008
422176,confirmed,ph,RENAISSANCE,2025-000247,2025-11-18,2025-11-18,no,,,,pl,sab,,"28"" NKPOKU-EBUBU P/L @RUMUOSUNWO ENEKA",4.88769,7.03167,Obio/Akpor,,la,"2"" VALVE AND 2"" ATTEMPTED ILLEGAL CONNECTIONS MEASURING ABOUT 0.65M APART INSTALLED AT 12 O'CLOCK POSITION FOR OIL THEFT BY AN PERSONUNKNOWN .",RI,,,,,2025-11-21,"nosdra,mnstry,cmpny,cmmnt,plc",,,,,,,,,,,,,2026-01-26 AB008
449010,confirmed,ph,RENAISSANCE,000241,2025-11-17,2025-11-17,cr,2,,,pl,eqf,,"20'' Rumuekpe - Nkpoku Pipeline @ Ibaa, Emouha LGA",4.9545222,6.8087611,Emuoha,0.018,la,Failed clamp,RI,,,,2026-02-13,2025-11-19,"nosdra,mnstry,cmpny,cmmnt",,,,2025-11-26,,,,,2025-12-19,,,,"2026-01-26 AB008, 2026-02-13 PH140"
422165,confirmed,ph,OANDO,2025/LAR/061,2025-11-17,2025-11-17,cr,5,,2025-11-18,pl,sab,,10'' OB-OB PIPELINE @ EBOCHA,5.4425556,6.5638889,Ogba/Egbema/Ndoni,0.00011880,la,THE TEAM OBSERVED A 2'' SCREW VALVE IINSTALLED AT 11O'CLOCK POSITION ON THE FACILITY N CONNECTION TO A 2'' GALVANIZED PIPE FOR OIL THEFT ACTIVITY.,RI,,,,,2025-11-18,"nosdra,mnstry,cmmnt,cmpny,plc,oth",,,,,,,,,,,,,2025-11-26 AB017
465940,confirmed,wa,Heritage,HEOSL/2025/318,2025-11-16,2025-11-17,cr,70,,,pl,eqf,bm,28'' TRANS FORCADOS PIPELINE AT EWEGBENE,5.5438889,5.5152778,Warri-South-West,,sw,"Vegetation, surface water and soil were impacted, the spill was within and outside the company's right of way.",DE,,,,,2026-01-07,"nosdra,dpr,mnstry,cmpny,cmmnt",,,,,,,,,,,,,2026-02-26 WA006
422174,confirmed,wa,SEPLAT,SEPLAT/WA/OS/19/2025,2025-11-14,2025-11-14,cr,3.1,2.6,,other:bulk line,sab,bm,6'' OVHOR - SAPELE BULK LINRE 4 ROW AT IGBEKU,5.8380556,5.6633333,Sapele,,"la,ss","Vegetation, soil and surface water were impacted, the spill was within the company's right of way.",DE,,,,,2025-11-19,"nosdra,dpr,mnstry,cmpny,cmmnt",,,,,,,,,,,,,2025-11-22 WA006
422173,confirmed,wa,NEPL,NEPL/HSE/OLO/111/03/25,2025-11-14,2025-11-16,no,,,,pl,sab,,OREDO 10'' CRUDE EXPORT LINE AT OLOGBO COMMUNITY AXIS,6.0657283,5.5895950,Ikpoba-Okha,,la,An illegal 3'' valve was attached to the company's crude export line,DE,,,,,2025-11-17,"nosdra,dpr,mnstry,cmpny,cmmnt",,,,,,,,,,,,,2025-11-22 WA006
422104,confirmed,uy,MPN,022/2025,2025-11-13,2025-11-14,other:Mystery sheen,0.013962,,,wh,ytd,other: Operations and Maintenance personnel were drafted to locationand they confirmed platform shut-in with no sign of liquid carryover,Ubit PP (Mfem DA) OML 67,4.5902778,8.4905556,Esit-Eket,,co,,,,2025-11-14,,,,,,,,,,,,,,,,,2025-11-26 AB017
449037,confirmed,wa,OANDO,2025/LAR/GLI/155,2025-11-12,2025-11-12,no,,,,pl,cor,,24'' KWALE - AKRI GAS PIPELINE AT BENEKU,5.6570556,6.5183889,Ndokwa-East,,la,,DE,,,,,2025-11-28,"nosdra,dpr,mnstry,cmpny,cmmnt",,,,,,,,,,,,,2025-12-08 WA006
422103,confirmed,uy,MPN,021/2025,2025-11-12,2025-11-13,cr,0.006289,,,wh,eqf,other: Gas was introduced to push out the oil from the SDV Bonnet andleak stopped. Sheen dispersed completely same day,Ubit PP / OML 68,4.2656297,8.1734514,,,of,,,,2025-11-13,,,,,,,,,,,,,,,,,2026-01-26 AB008
422105,confirmed,ph,RENAISSANCE,2025_000226,2025-11-09,2025-11-09,cr,193,149,2025-11-10,fs,ome,bm,Bonny oil and gas terminal slot jetty at Bonny,4.42664,7.15865,Bonny,0.0860,iw,overflow from the bonny oil and gas terminal saver pit at the jetty area,RI,,,,,2025-11-11,"cmmnt,cmpny,dpr,mnstry,plc,nosdra",2025-11-18,2025-11-22,Flashing and mop-up,,,,,,2026-01-14,,,,"2025-11-26 AB017, 2026-02-18 PH002, 2026-03-02 AB008"
422095,confirmed,by,RENAISSANCE,2025_000227,2025-11-09,2025-11-09,cr,13,,2025-11-13,fl,eqf,bm,DIEBU CREEK WELL1s INLET MANIFOLD ELBOW AT PEREMABIRI,4.6601389,6.0789444,Southern-Ijaw,0.0027,sw,THERE WAS A EQUIPMENT FAILURE WITHIN THE DIEBU CREEK INLET MANIFOLD ELBOW AS A RESULT OF INTERNAL CORROSION.,BY,,2025-12-18,,,2025-11-13,"nosdra,mnstry,cmpny,cmmnt,mltry",,,,,,,,,,,,,"2025-11-26 AB017, 2026-03-02 AB008, 2026-03-18 BY015"
422097,confirmed,PH,NEPL,NEPL/HSE/AFAM/11/001/25,2025-11-02,2025-11-02,cr,5,188,,wh,sab,bw,"AFAM WELL 3, AFAM - NATE COMMUNITY, OYIGBO LGA",4.8058333,7.3308333,Oyigbo,0.0002,la,vandalization of well head.,,,,,,2025-11-07,"nosdra,mnstry,cmmnt,cmpny",,,,,,,,,,,,,2025-11-26 AB017
422096,reviewed,ph,OANDO,2025/LAR/060,2025-11-02,2025-11-02,co,0.12,MOPPE UP,,fl,sab,,"4'' OBIAFU 13L FLOWLINE OBIAFU FIELD, MOKU COMMUNITY, ONELGA",5.3918056,6.6333333,Ogba/Egbema/Ndoni,0.00001891,,HACKSAW CUT,RI,,,,,2025-11-03,"nosdra,mnstry,cmmnt,cmpny",,,,,,,,,,,,,2025-11-26 AB017
